{
  "schema_version": "1.0",
  "baseline_status": "candidate_pending_d2",
  "d1_approval_ref": "systems_engineering/reports/b0/g15b_d1_approval.md",
  "sources": [
    {"id": "B0-SRC-CHARTER", "path": "systems_engineering/project_charter.md", "revision": "02e59d4654e87d85ef3543e0812a5e373be684ac", "locator": "#purpose and #product-boundaries", "role": "intent"},
    {"id": "B0-SRC-BASELINE", "path": "systems_engineering/development_baseline.md", "revision": "02e59d4654e87d85ef3543e0812a5e373be684ac", "locator": "#single-objective, #included, #excluded-from-b0 and #delivery-gates", "role": "intent"},
    {"id": "B0-SRC-G0-V2", "path": "05_integration/b0/configs/b0_g0_contract.v2.json", "revision": "02e59d4654e87d85ef3543e0812a5e373be684ac", "locator": "JSON Pointer recorded by each acceptance condition", "role": "g0_contract"},
    {"id": "B0-SRC-G0-APPROVAL", "path": "systems_engineering/reports/b0/g0_approval_decision.md", "revision": "02e59d4654e87d85ef3543e0812a5e373be684ac", "locator": "#决定", "role": "approval"},
    {"id": "B0-SRC-ARCHITECTURE", "path": "systems_engineering/models/architecture.md", "revision": "02e59d4654e87d85ef3543e0812a5e373be684ac", "locator": "#modular-boundaries, #coordinate-and-unit-conventions and #imu-measurement-convention", "role": "architecture"},
    {"id": "B0-SRC-VERIFICATION", "path": "systems_engineering/verification/verification_plan.md", "revision": "02e59d4654e87d85ef3543e0812a5e373be684ac", "locator": "#b0-checks and #evidence-chain", "role": "verification_plan"},
    {"id": "B0-SRC-G0-ACCEPTANCE", "path": "systems_engineering/verification/g0_acceptance.md", "revision": "02e59d4654e87d85ef3543e0812a5e373be684ac", "locator": "#指标口径 and #八类场景", "role": "verification_plan"},
    {"id": "B0-SRC-LEGACY", "path": "systems_engineering/requirements/legacy_requirements.md", "revision": "02e59d4654e87d85ef3543e0812a5e373be684ac", "locator": "#control-requirements and #status", "role": "historical"},
    {"id": "B0-SRC-G1", "path": "01_simulation/b0/README.md", "revision": "02e59d4654e87d85ef3543e0812a5e373be684ac", "locator": "component scope, commands and evidence limits", "role": "implementation_evidence"}
  ],
  "requirements": [
    {
      "id": "B0-REQ-0001", "title": "Bounded attitude experiment", "type": "functional", "level": "stakeholder", "status": "candidate_pending_d2",
      "statement": "The B0 system shall execute a configured bounded multirotor attitude-estimation and control experiment without representing the experiment as full-flight capability.",
      "rationale": "Defines the single B0 product use while preventing scaffold and extension scope from becoming an implicit obligation.",
      "source_ids": ["B0-SRC-CHARTER", "B0-SRC-BASELINE"], "applicability": {"state": "applicable", "scope": "B0 v0.2 bounded attitude experiment", "approval_ref": null},
      "responsible_components": ["B0-MODEL-SYSTEM"], "model_element_ids": ["B0-MODEL-SYSTEM", "B0-MODEL-COMMAND-SOURCE"], "verification_ids": ["B0-VER-SCOPE-INSPECTION"],
      "acceptance_condition": "Inspection confirms the joint baseline includes the bounded experiment and excludes translation, flight, hardware and unactivated extensions.", "legacy_refs": [], "parent_id": null, "supersedes": null, "change_note": "Initial D1-authorized allocation; candidate until D2."
    },
    {
      "id": "B0-REQ-0002", "title": "Deterministic configuration and replay", "type": "quality", "level": "system", "status": "candidate_pending_d2",
      "statement": "The B0 system shall produce repeatable samples and state evolution for identical approved configuration, seed, initial state, input sequence, reset sequence and software revision.",
      "rationale": "Repeatability is required for engineering comparison and release evidence.",
      "source_ids": ["B0-SRC-BASELINE", "B0-SRC-G0-V2"], "applicability": {"state": "applicable", "scope": "all deterministic and stochastic B0 scenarios", "approval_ref": null},
      "responsible_components": ["B0-MODEL-EXECUTION"], "model_element_ids": ["B0-MODEL-EXECUTION", "B0-MODEL-SCENARIO"], "verification_ids": ["B0-VER-REPLAY"],
      "acceptance_condition": "The procedure in B0-VER-REPLAY compares two approved replays at the G0 reset-replay fields and tolerances and records configuration, seed and revision.", "legacy_refs": [], "parent_id": "B0-REQ-0001", "supersedes": null, "change_note": "Initial D1-authorized allocation; candidate until D2."
    },
    {
      "id": "B0-REQ-0003", "title": "Runtime truth isolation", "type": "interface", "level": "system", "status": "candidate_pending_d2",
      "statement": "The B0 system shall prevent live plant truth from entering estimator or controller runtime inputs after explicit initialization while permitting truth to reach sensor generation and independent evaluation.",
      "rationale": "Prevents circular validation and unrealistically privileged control or estimation.",
      "source_ids": ["B0-SRC-BASELINE", "B0-SRC-G0-V2", "B0-SRC-ARCHITECTURE"], "applicability": {"state": "applicable", "scope": "runtime after explicit reset initialization", "approval_ref": null},
      "responsible_components": ["B0-MODEL-EXECUTION"], "model_element_ids": ["B0-MODEL-TRUTH", "B0-MODEL-ESTIMATOR", "B0-MODEL-CONTROLLER", "B0-MODEL-EVALUATOR"], "verification_ids": ["B0-VER-TRUTH-BOUNDARY"],
      "acceptance_condition": "Static interface inspection and a later integrated negative test show no runtime truth path to estimator or controller, using the G0 truth_visibility and truth_inputs_forbidden fields.", "legacy_refs": [], "parent_id": "B0-REQ-0001", "supersedes": null, "change_note": "Initial D1-authorized allocation; candidate until D2."
    },
    {
      "id": "B0-REQ-0004", "title": "Shared frames units and quaternion convention", "type": "constraint", "level": "system", "status": "candidate_pending_d2",
      "statement": "The B0 system shall represent exchanged quantities using the approved NED and body frames, SI units, and scalar-first Hamilton quaternion convention.",
      "rationale": "A single convention prevents silent sign, frame and ordering defects across components.",
      "source_ids": ["B0-SRC-ARCHITECTURE", "B0-SRC-G0-V2"], "applicability": {"state": "applicable", "scope": "all B0 component interfaces and retained evidence", "approval_ref": null},
      "responsible_components": ["B0-MODEL-SYSTEM"], "model_element_ids": ["B0-MODEL-SYSTEM"], "verification_ids": ["B0-VER-CONVENTIONS"],
      "acceptance_condition": "Inspection and component analytical cases confirm every interface and oracle references the approved G0 convention fields without a conflicting local definition.", "legacy_refs": [], "parent_id": "B0-REQ-0001", "supersedes": null, "change_note": "Initial D1-authorized allocation; candidate until D2."
    },
    {
      "id": "B0-REQ-0005", "title": "Rigid-body rotational dynamics", "type": "functional", "level": "component", "status": "candidate_pending_d2",
      "statement": "The B0 plant shall propagate body angular velocity using the approved rigid-body rotational equation and positive-definite inertia contract.",
      "rationale": "Defines the physical responsibility required by the bounded attitude experiment.",
      "source_ids": ["B0-SRC-BASELINE", "B0-SRC-G0-V2", "B0-SRC-G1"], "applicability": {"state": "applicable", "scope": "B0 rotational plant", "approval_ref": null},
      "responsible_components": ["B0-MODEL-PLANT"], "model_element_ids": ["B0-MODEL-PLANT"], "verification_ids": ["B0-VER-PLANT-DYNAMICS"],
      "acceptance_condition": "Analytical zero-torque and principal-axis cases match an independent equation oracle at the G0 precision and inertia references.", "legacy_refs": [], "parent_id": "B0-REQ-0001", "supersedes": null, "change_note": "Initial D1-authorized allocation; candidate until D2."
    },
    {
      "id": "B0-REQ-0006", "title": "Quaternion plant state", "type": "functional", "level": "component", "status": "candidate_pending_d2",
      "statement": "The B0 plant shall propagate and normalize its scalar-first attitude quaternion using the approved body-rate and frame convention.",
      "rationale": "Attitude propagation must remain consistent with the shared representation.",
      "source_ids": ["B0-SRC-G0-V2", "B0-SRC-ARCHITECTURE", "B0-SRC-G1"], "applicability": {"state": "applicable", "scope": "B0 rotational plant", "approval_ref": null},
      "responsible_components": ["B0-MODEL-PLANT"], "model_element_ids": ["B0-MODEL-PLANT", "B0-MODEL-TRUTH"], "verification_ids": ["B0-VER-PLANT-QUATERNION"],
      "acceptance_condition": "Independent constant-rate analytical cases account for q/-q equivalence and confirm normalization within the approved G0 tolerance.", "legacy_refs": [], "parent_id": "B0-REQ-0005", "supersedes": null, "change_note": "Initial D1-authorized allocation; candidate until D2."
    },
    {
      "id": "B0-REQ-0007", "title": "Paired torque command", "type": "interface", "level": "component", "status": "candidate_pending_d2",
      "statement": "The B0 controller shall publish one timestamped torque command that pairs requested torque, limited target and saturation status from the same controller due tick.",
      "rationale": "The pairing closes ambiguity between request, clamp result and anti-windup feedback.",
      "source_ids": ["B0-SRC-G0-V2"], "applicability": {"state": "applicable", "scope": "controller-to-actuator interface", "approval_ref": null},
      "responsible_components": ["B0-MODEL-CONTROLLER"], "model_element_ids": ["B0-MODEL-CONTROLLER", "B0-MODEL-TORQUE-COMMAND"], "verification_ids": ["B0-VER-PAIRED-COMMAND"],